,dominant_topic,original_text,topic_perc_contrib,tokens,num_tokens,unique_tokens,num_unique_tokens,keywords
638,Content & Authenticity,One of the best entries in this franchise!,0.6662999987602234,['one_best_entries'],1,['one_best_entries'],1,"three_kingdoms, series, fan, diplomacy, battle, love, best_total_war, campaign, total_war_games, fun"
1460,Content & Authenticity,Great game with alot of new features but it lacks unique design for all main romance heroes.,0.8881000280380249,"['alot', 'new_features', 'design', 'romance', 'hero']",5,"['hero', 'design', 'alot', 'romance', 'new_features']",5,"three_kingdoms, series, fan, diplomacy, battle, love, best_total_war, campaign, total_war_games, fun"
1844,Characters,"can rule china buy trading rice.

Broken Marriage/10",0.8457000255584717,"['rule_china', 'trading', 'rice', 'marriage']",4,"['trading', 'rule_china', 'rice', 'marriage']",4,"china, war, cao_cao, lu_bu, liu_bei, yuan_shao, army, character, man, emperor"
382,Content & Authenticity,"Absolute blast,
Best TW ive played",0.8330000042915344,"['blast', 'best_tw', 'ive_played']",3,"['blast', 'ive_played', 'best_tw']",3,"three_kingdoms, series, fan, diplomacy, battle, love, best_total_war, campaign, total_war_games, fun"
111,Content & Authenticity,really good. everything you want in a total war game. cant wait for dlc,0.6664000153541565,['wait_dlc'],1,['wait_dlc'],1,"three_kingdoms, series, fan, diplomacy, battle, love, best_total_war, campaign, total_war_games, fun"
3589,Content & Authenticity,Little bugs. New mechanics. Looks great. Recommend,0.4959000051021576,"['bug', 'new_mechanics']",2,"['new_mechanics', 'bug']",2,"three_kingdoms, series, fan, diplomacy, battle, love, best_total_war, campaign, total_war_games, fun"
1096,Content & Authenticity,"Probably one of the better Total War games, though plagued by bugs and bad UI",0.4925000071525574,"['total_war_games', 'bug']",2,"['bug', 'total_war_games']",2,"three_kingdoms, series, fan, diplomacy, battle, love, best_total_war, campaign, total_war_games, fun"
3640,Content & Authenticity,Well worth the wait - Amazballs!!,0.6664000153541565,['worth_wait'],1,['worth_wait'],1,"three_kingdoms, series, fan, diplomacy, battle, love, best_total_war, campaign, total_war_games, fun"
855,Tactical Gameplay,"Shogun 2 with a big diplomacy system upgrade. Oh, and heroes. Taishi Ci for the win!!!",0.6510000228881836,"['shogun_two', 'diplomacy', 'upgrade', 'hero', 'win']",5,"['win', 'diplomacy', 'upgrade', 'hero', 'shogun_two']",5,"unit, battle, faction, army, general, character, diplomacy, campaign, hero, building"
82,Characters,first thing i do is annihilate liu bei :p,0.6150000095367432,['liu_bei'],1,['liu_bei'],1,"china, war, cao_cao, lu_bu, liu_bei, yuan_shao, army, character, man, emperor"
242,Content & Authenticity,Beautiful genre in a magnificent time period. Even better than Shogun 2.,0.5666999816894531,"['genre', 'time_period', 'shogun_two']",3,"['genre', 'shogun_two', 'time_period']",3,"three_kingdoms, series, fan, diplomacy, battle, love, best_total_war, campaign, total_war_games, fun"
925,Characters,"fun game, let me get sun jian to live until he died of old age instead of arrows to the back",0.41100001335144043,"['sun_jian', 'old_age']",2,"['sun_jian', 'old_age']",2,"china, war, cao_cao, lu_bu, liu_bei, yuan_shao, army, character, man, emperor"
1531,Content & Authenticity,"By far the best Total War game, the mechanics are smooth, campaign feels relevant, and as always the battles are a blast",0.8881999850273132,"['best_total_war', 'mechanic', 'campaign', 'battle', 'blast']",5,"['mechanic', 'best_total_war', 'campaign', 'blast', 'battle']",5,"three_kingdoms, series, fan, diplomacy, battle, love, best_total_war, campaign, total_war_games, fun"
1202,Content & Authenticity,"Best game to learn more about China. If you liked Warhammer 2, this game will please you. 
It combines the best of Warhammer 2 and does not have the bad ones. So have fun and enjoy. :)",0.8579000234603882,"['china', 'warhammer_two', 'combine', 'warhammer_two']",4,"['warhammer_two', 'china', 'combine']",3,"three_kingdoms, series, fan, diplomacy, battle, love, best_total_war, campaign, total_war_games, fun"
2312,Content & Authenticity,"Gameplay looks amazing no lags, Duel is pretty good, overall this game is pretty good.",0.8314999938011169,"['gameplay', 'lag', 'duel']",3,"['lag', 'duel', 'gameplay']",3,"three_kingdoms, series, fan, diplomacy, battle, love, best_total_war, campaign, total_war_games, fun"
1675,Content & Authenticity,A great direcion TW took here. I like it!,0.6664000153541565,"['direcion', 'tw']",2,"['direcion', 'tw']",2,"three_kingdoms, series, fan, diplomacy, battle, love, best_total_war, campaign, total_war_games, fun"
1144,"UX/UI, Performance, Stability","Dayumed fuckin good.

Dunno about the 4 bucks DLC though.",0.5595999956130981,['buck'],1,['buck'],1,"campaign, hour, issue, battle, bug, crash, multiplayer, review, rome, fix"
3482,Strategic Gameplay,"The game seems fun, but I cannot access the Diplomacy button and can literally do no diplomatic actions.",0.6305999755859375,"['access', 'diplomacy', 'button', 'action']",4,"['button', 'action', 'access', 'diplomacy']",4,"faction, army, diplomacy, vassal, war, player, people, way, city, problem"
1696,Strategic Gameplay,Play 15h straight. If i play a game hours on end is good in my book =),0.7063999772071838,"['15h', 'end', 'book']",3,"['15h', 'book', 'end']",3,"faction, army, diplomacy, vassal, war, player, people, way, city, problem"
1648,Characters,"""It's Lu Bu, do not pursue!""

11/10 Would rout my army against Fengxian again.",0.8068000078201294,"['lu_bu', '11_10', 'rout', 'army', 'fengxian']",5,"['lu_bu', 'army', 'rout', '11_10', 'fengxian']",5,"china, war, cao_cao, lu_bu, liu_bei, yuan_shao, army, character, man, emperor"
1654,Content & Authenticity,this game understands me. It's got strategy and it's got stupidly crazy generals that just go nuts.,0.4636000096797943,"['strategy', 'general', 'nut']",3,"['general', 'strategy', 'nut']",3,"three_kingdoms, series, fan, diplomacy, battle, love, best_total_war, campaign, total_war_games, fun"
653,Content & Authenticity,This is the best entry in the series.,0.7774999737739563,"['entry', 'series']",2,"['entry', 'series']",2,"three_kingdoms, series, fan, diplomacy, battle, love, best_total_war, campaign, total_war_games, fun"
1511,Tactical Gameplay,Game is very fun to play and I didn't really have any issues but there is one thing that's bothering me: how can peasants win 1v1 with regular units?,0.4415999948978424,"['issue', 'peasant', 'unit']",3,"['unit', 'peasant', 'issue']",3,"unit, battle, faction, army, general, character, diplomacy, campaign, hero, building"
287,Content & Authenticity,This game actually came out in a great state. *cough Rome II*,0.83160001039505,"['state', 'cough', 'rome_two']",3,"['state', 'rome_two', 'cough']",3,"three_kingdoms, series, fan, diplomacy, battle, love, best_total_war, campaign, total_war_games, fun"
1562,Characters,One of the best Total War Games out there!,0.5533000230789185,['one_best_total_war'],1,['one_best_total_war'],1,"china, war, cao_cao, lu_bu, liu_bei, yuan_shao, army, character, man, emperor"
1238,Content & Authenticity,Probably one of the best of the Total War Historical games. The Diplomatic system is so far the best of any Total War games and the Romance mode adds a breath of fresh air to the Total War formula.,0.6642000079154968,"['probably_one_best', 'best_total_war_games', 'romance_mode', 'breath_fresh_air', 'total_war_formula']",5,"['probably_one_best', 'romance_mode', 'total_war_formula', 'breath_fresh_air', 'best_total_war_games']",5,"three_kingdoms, series, fan, diplomacy, battle, love, best_total_war, campaign, total_war_games, fun"
2920,Content & Authenticity,"The game is well polished and feels like almost every aspect of the game has been made with warm and caring hands

Buy it.",0.8325999975204468,"['feel', 'aspect', 'hand']",3,"['aspect', 'hand', 'feel']",3,"three_kingdoms, series, fan, diplomacy, battle, love, best_total_war, campaign, total_war_games, fun"
2649,Strategic Gameplay,Not enough Japanese people in the game 1/10,0.5748000144958496,['people'],1,['people'],1,"faction, army, diplomacy, vassal, war, player, people, way, city, problem"
3055,Content & Authenticity,Like it. Love it. keep playing it. ha three things.,0.3328000009059906,[],0,[],0,"three_kingdoms, series, fan, diplomacy, battle, love, best_total_war, campaign, total_war_games, fun"
64,Content & Authenticity,Great Game. Alot of innovative ideas and well executed. Relatively bug-free on launch as well!,0.6758000254631042,"['alot', 'idea', 'bug', 'launch']",4,"['alot', 'launch', 'bug', 'idea']",4,"three_kingdoms, series, fan, diplomacy, battle, love, best_total_war, campaign, total_war_games, fun"
3048,Content & Authenticity,"*Easy mode in Caocao 曹操* it seems easy to play

1 day later.....

Still loading my old saves to do the right decisions again",0.3407000005245209,"['mode', 'caocao', 'day', 'decision']",4,"['caocao', 'mode', 'decision', 'day']",4,"three_kingdoms, series, fan, diplomacy, battle, love, best_total_war, campaign, total_war_games, fun"
145,Content & Authenticity,Great game and interesting AI gameplay which make the progress seems like watching a three kingdom drama.,0.866100013256073,"['gameplay', 'progress', 'three_kingdom', 'drama']",4,"['progress', 'three_kingdom', 'drama', 'gameplay']",4,"three_kingdoms, series, fan, diplomacy, battle, love, best_total_war, campaign, total_war_games, fun"
2870,Content & Authenticity,"Loving the new diplomacy system. Just a shame this wont be apart of Warhammer 3...
Otherwise best historical Total War to date!",0.8885999917984009,"['diplomacy', 'shame', 'warhammer_three', 'best_historical', 'date']",5,"['best_historical', 'shame', 'date', 'diplomacy', 'warhammer_three']",5,"three_kingdoms, series, fan, diplomacy, battle, love, best_total_war, campaign, total_war_games, fun"
2334,"UX/UI, Performance, Stability",Good Dynasty Warrior feel. Most optimized Total War imo. Beautiful art and music.,0.7631000280380249,"['dynasty_warrior', 'art', 'music']",3,"['dynasty_warrior', 'art', 'music']",3,"campaign, hour, issue, battle, bug, crash, multiplayer, review, rome, fix"
2977,Content & Authenticity,"Lets go! 12 hours later 
WOOOOOOOOOOOOOOOOOOOOOOOOOOOOOOOOOOOOOOOOOOOOOOOOOOOOOOOOOOOOOOOOOOOOW! 
Best  total war to date!!!",0.4442000091075897,"['12_hours', 'best_total_war_date']",2,"['12_hours', 'best_total_war_date']",2,"three_kingdoms, series, fan, diplomacy, battle, love, best_total_war, campaign, total_war_games, fun"
853,Strategic Gameplay,"Excellent game, some slight dodgy DLC practices but otherwise very good.",0.7087000012397766,"['dodgy', 'dlc', 'practice']",3,"['dodgy', 'dlc', 'practice']",3,"faction, army, diplomacy, vassal, war, player, people, way, city, problem"
3585,"UX/UI, Performance, Stability","i can't even describe this masterpiece ... 
everything 11/10

",0.5444999933242798,"['masterpiece', '11_10']",2,"['masterpiece', '11_10']",2,"campaign, hour, issue, battle, bug, crash, multiplayer, review, rome, fix"
156,Content & Authenticity,I like it a lot. You should like it a lot too.,0.3328000009059906,[],0,[],0,"three_kingdoms, series, fan, diplomacy, battle, love, best_total_war, campaign, total_war_games, fun"
2318,Content & Authenticity,"I have played every total war since Shogun 1 and this is Best Total War so far, I love all the new mechanics and the best part is you cannot just become a big power and easily win.. the game will always challenge you.",0.6234999895095825,"['shogun', 'one_best_total_war', 'new_mechanics', 'power', 'challenge']",5,"['shogun', 'power', 'one_best_total_war', 'new_mechanics', 'challenge']",5,"three_kingdoms, series, fan, diplomacy, battle, love, best_total_war, campaign, total_war_games, fun"
791,Content & Authenticity,best total war game in ages!!,0.5067999958992004,"['best_total_war', 'age']",2,"['best_total_war', 'age']",2,"three_kingdoms, series, fan, diplomacy, battle, love, best_total_war, campaign, total_war_games, fun"
3320,Content & Authenticity,9/10. Now bring us Total War: Game of Thrones.,0.6593000292778015,['throne'],1,['throne'],1,"three_kingdoms, series, fan, diplomacy, battle, love, best_total_war, campaign, total_war_games, fun"
1503,Content & Authenticity,"Best Total War to date. Does everything previous titles did, but better.",0.7773000001907349,"['best_total_war_date', 'previous_titles']",2,"['previous_titles', 'best_total_war_date']",2,"three_kingdoms, series, fan, diplomacy, battle, love, best_total_war, campaign, total_war_games, fun"
84,Content & Authenticity,"A great TW, especially in co-op.",0.3328000009059906,[],0,[],0,"three_kingdoms, series, fan, diplomacy, battle, love, best_total_war, campaign, total_war_games, fun"
2700,Content & Authenticity,"Simply amazing and extremely fun
If you are a fan of Three Kingdom then you should absolutely buy it",0.7760999798774719,"['fan', 'three_kingdom']",2,"['three_kingdom', 'fan']",2,"three_kingdoms, series, fan, diplomacy, battle, love, best_total_war, campaign, total_war_games, fun"
1886,Content & Authenticity,"Supremely balanced, intelligent, and deeply strategic. I love it !",0.3328000009059906,[],0,[],0,"three_kingdoms, series, fan, diplomacy, battle, love, best_total_war, campaign, total_war_games, fun"
1379,Content & Authenticity,It is fun just wish mods would come out.,0.7752000093460083,"['wish', 'mod']",2,"['wish', 'mod']",2,"three_kingdoms, series, fan, diplomacy, battle, love, best_total_war, campaign, total_war_games, fun"
3084,Strategic Gameplay,the black circle under a general's foot is very strange........it seems like a black hole,0.5834000110626221,"['circle', 'foot', 'hole']",3,"['foot', 'circle', 'hole']",3,"faction, army, diplomacy, vassal, war, player, people, way, city, problem"
2566,Content & Authenticity,"band new totalwar gameplay experience
better than expected",0.8330000042915344,"['band', 'totalwar', 'gameplay', 'experience']",4,"['band', 'totalwar', 'experience', 'gameplay']",4,"three_kingdoms, series, fan, diplomacy, battle, love, best_total_war, campaign, total_war_games, fun"
946,Content & Authenticity,The most polished Total War game to date,0.6664000153541565,['date'],1,['date'],1,"three_kingdoms, series, fan, diplomacy, battle, love, best_total_war, campaign, total_war_games, fun"
197,Content & Authenticity,Some really great refinements to the Total War formula make this one of the most compelling offerings yet. It also give me excited to see the propagation of these features in other titles upcoming in the franchise.,0.8331000208854675,"['total_war_formula', 'offering', 'propagation', 'title', 'franchise']",5,"['title', 'total_war_formula', 'propagation', 'offering', 'franchise']",5,"three_kingdoms, series, fan, diplomacy, battle, love, best_total_war, campaign, total_war_games, fun"
245,Content & Authenticity,got this game because of OverSimplified,0.3328000009059906,[],0,[],0,"three_kingdoms, series, fan, diplomacy, battle, love, best_total_war, campaign, total_war_games, fun"
412,Content & Authenticity,The best Total War title since Shogun 2.,0.8331999778747559,"['best_total_war', 'title', 'shogun_two']",3,"['title', 'best_total_war', 'shogun_two']",3,"three_kingdoms, series, fan, diplomacy, battle, love, best_total_war, campaign, total_war_games, fun"
3492,Content & Authenticity,Best total war game ever played! :),0.6664000153541565,['best_total_war'],1,['best_total_war'],1,"three_kingdoms, series, fan, diplomacy, battle, love, best_total_war, campaign, total_war_games, fun"
1637,Content & Authenticity,The best Total War experience yet!,0.777400016784668,"['best_total_war', 'experience']",2,"['best_total_war', 'experience']",2,"three_kingdoms, series, fan, diplomacy, battle, love, best_total_war, campaign, total_war_games, fun"
612,Characters,"great game, time flies when you're taking over china",0.6110000014305115,['china'],1,['china'],1,"china, war, cao_cao, lu_bu, liu_bei, yuan_shao, army, character, man, emperor"
2423,Content & Authenticity,Three Kingdoms is easily one of the best games in the series.,0.8328999876976013,"['three_kingdoms', 'one_best', 'series']",3,"['one_best', 'series', 'three_kingdoms']",3,"three_kingdoms, series, fan, diplomacy, battle, love, best_total_war, campaign, total_war_games, fun"
1674,Content & Authenticity,"Combat is smooth, and feels rewarding.  Lots of diplomacy- much more than the previous versions.  Definitely worth it!",0.8655999898910522,"['combat', 'diplomacy', 'version', 'definitely_worth']",4,"['version', 'diplomacy', 'definitely_worth', 'combat']",4,"three_kingdoms, series, fan, diplomacy, battle, love, best_total_war, campaign, total_war_games, fun"
3460,Strategic Gameplay,"Ignore negative reviews, most of them are just shitters who are getting fucked by the AI. How bad do you have to be to get fucked by the AI?",0.7228000164031982,"['review', 'shitter', 'ai']",3,"['ai', 'review', 'shitter']",3,"faction, army, diplomacy, vassal, war, player, people, way, city, problem"
1005,Characters,A really fun game. did this for summer sale.,0.6148999929428101,['summer_sale'],1,['summer_sale'],1,"china, war, cao_cao, lu_bu, liu_bei, yuan_shao, army, character, man, emperor"
761,Content & Authenticity,I'm new to total war games but this is by far the best game i've played in a long time,0.7774999737739563,"['total_war_games', 'long_time']",2,"['long_time', 'total_war_games']",2,"three_kingdoms, series, fan, diplomacy, battle, love, best_total_war, campaign, total_war_games, fun"
1745,Content & Authenticity,best of all the TW games,0.6661999821662903,['tw_games'],1,['tw_games'],1,"three_kingdoms, series, fan, diplomacy, battle, love, best_total_war, campaign, total_war_games, fun"
1428,Content & Authenticity,"I wasn't sure about this game in the beginning.
But what can I say: It's awesome!
",0.3328000009059906,[],0,[],0,"three_kingdoms, series, fan, diplomacy, battle, love, best_total_war, campaign, total_war_games, fun"
3561,Content & Authenticity,Best total war ever. Game play and graphics are amazing. Everything feels nice and I wont loose interest. The campaign is much more detailed than the others. Getting the might Dong is pretty hard. I got it after many tries. I am so happy!!!,0.8324999809265137,"['best_total_war', 'graphics_amazing', 'campaign']",3,"['best_total_war', 'campaign', 'graphics_amazing']",3,"three_kingdoms, series, fan, diplomacy, battle, love, best_total_war, campaign, total_war_games, fun"
268,Content & Authenticity,Refreshing for the Total War series. The added diplomacy moptions really adds a good amount of replayability.,0.8320000171661377,"['series', 'diplomacy', 'moption', 'replayability']",4,"['replayability', 'moption', 'series', 'diplomacy']",4,"three_kingdoms, series, fan, diplomacy, battle, love, best_total_war, campaign, total_war_games, fun"
929,Characters,"Lu Bu op, would Lu Bu again",0.7433000206947327,"['lu_bu', 'lu_bu']",2,['lu_bu'],1,"china, war, cao_cao, lu_bu, liu_bei, yuan_shao, army, character, man, emperor"
677,Content & Authenticity,its a really nice game i would recommend,0.3328000009059906,[],0,[],0,"three_kingdoms, series, fan, diplomacy, battle, love, best_total_war, campaign, total_war_games, fun"
1941,"UX/UI, Performance, Stability",Easily the most fun I've had in a total war game. The romantic version plays like a Chinese game of thrones and the game play keeps bringing me back for some long sessions.,0.7688999772071838,"['version', 'throne', 'session']",3,"['version', 'session', 'throne']",3,"campaign, hour, issue, battle, bug, crash, multiplayer, review, rome, fix"
990,Content & Authenticity,One of the most polished TW games at release. Still need to get more into the campaign but the battles are awesome.,0.8654999732971191,"['tw_games', 'need', 'campaign', 'battle']",4,"['campaign', 'battle', 'need', 'tw_games']",4,"three_kingdoms, series, fan, diplomacy, battle, love, best_total_war, campaign, total_war_games, fun"
1566,Content & Authenticity,Always loved three kingdoms an all dynasty warriors so happy theres a total war version and its actually a really good game in my opinion the odd thing i might change but just a great game,0.8877999782562256,"['three_kingdoms', 'dynasty_warriors', 'version', 'opinion', 'change']",5,"['change', 'three_kingdoms', 'opinion', 'version', 'dynasty_warriors']",5,"three_kingdoms, series, fan, diplomacy, battle, love, best_total_war, campaign, total_war_games, fun"
872,Content & Authenticity,"Total War and Three Kingdoms era China? Would watch Luoyang burn again/10
",0.3328000009059906,"['three_kingdoms_era_china', 'luoyang']",2,"['three_kingdoms_era_china', 'luoyang']",2,"three_kingdoms, series, fan, diplomacy, battle, love, best_total_war, campaign, total_war_games, fun"
2103,Tactical Gameplay,"the Game is great, only one thing is making me Sad, there are no Town batlle with wall's and that you are the Def party... then only thing what the AI do is Siege you till you are starving or that you Atk them..",0.8258000016212463,"['town', 'batlle', 'wall', 'party', 'siege']",5,"['siege', 'wall', 'batlle', 'town', 'party']",5,"unit, battle, faction, army, general, character, diplomacy, campaign, hero, building"
3080,"UX/UI, Performance, Stability","Like any other total war game, INSTALL on SSD for fast load times",0.7063000202178955,"['ssd', 'load_times']",2,"['ssd', 'load_times']",2,"campaign, hour, issue, battle, bug, crash, multiplayer, review, rome, fix"
548,Content & Authenticity,one of the most interesting total war games ever!!!,0.6661999821662903,['total_war_games'],1,['total_war_games'],1,"three_kingdoms, series, fan, diplomacy, battle, love, best_total_war, campaign, total_war_games, fun"
3559,Content & Authenticity,i love this game the one on one fights is so cool i can say three kingdoms total war gets a yes from me i also recommend it to try you might just love it.,0.6644999980926514,['three_kingdoms'],1,['three_kingdoms'],1,"three_kingdoms, series, fan, diplomacy, battle, love, best_total_war, campaign, total_war_games, fun"
1437,Characters,"An excellent Total War game. 9/10, would solo armies with Lu Bu again.",0.8069000244140625,"['solo', 'army', 'lu_bu']",3,"['solo', 'lu_bu', 'army']",3,"china, war, cao_cao, lu_bu, liu_bei, yuan_shao, army, character, man, emperor"
1044,Content & Authenticity,Really enjoyed this game. Can't wait to play it more,0.3328000009059906,[],0,[],0,"three_kingdoms, series, fan, diplomacy, battle, love, best_total_war, campaign, total_war_games, fun"
3271,Content & Authenticity,"Simply amazing, so glad TWTK is finally here. PLEASE GIVE US THE BLOOD MOD.",0.4758000075817108,"['twtk', 'blood', 'mod']",3,"['twtk', 'mod', 'blood']",3,"three_kingdoms, series, fan, diplomacy, battle, love, best_total_war, campaign, total_war_games, fun"
276,Content & Authenticity,Total War incorporating romance and saga into it. Brilliant setup,0.47269999980926514,"['romance', 'saga', 'setup']",3,"['setup', 'saga', 'romance']",3,"three_kingdoms, series, fan, diplomacy, battle, love, best_total_war, campaign, total_war_games, fun"
1337,Content & Authenticity,That oversimplified sold it for me. Truly the best of the franchise,0.6664000153541565,['franchise'],1,['franchise'],1,"three_kingdoms, series, fan, diplomacy, battle, love, best_total_war, campaign, total_war_games, fun"
891,Strategic Gameplay,"Great game, wish campaign could be more than 2 players tho",0.6780999898910522,"['campaign', 'player']",2,"['campaign', 'player']",2,"faction, army, diplomacy, vassal, war, player, people, way, city, problem"
2706,Content & Authenticity,Lovely. I wasn't convinced to buy it at the beginning but I bought it anyways and I don't regret it. I love the new romance mode and the campaign mechanics.,0.8655999898910522,"['regret', 'romance_mode', 'campaign', 'mechanic']",4,"['mechanic', 'romance_mode', 'campaign', 'regret']",4,"three_kingdoms, series, fan, diplomacy, battle, love, best_total_war, campaign, total_war_games, fun"
3554,Content & Authenticity,lack of content and events but almost perfect !,0.8288000226020813,"['lack', 'content', 'event']",3,"['content', 'lack', 'event']",3,"three_kingdoms, series, fan, diplomacy, battle, love, best_total_war, campaign, total_war_games, fun"
2130,"UX/UI, Performance, Stability",I haven't decided whether I like this game or not.  In my mind I wonder if I haven't bought another turkey.  Judge for yourselves  though.,0.7056999802589417,"['mind', 'wonder', 'turkey', 'judge']",4,"['wonder', 'mind', 'judge', 'turkey']",4,"campaign, hour, issue, battle, bug, crash, multiplayer, review, rome, fix"
621,Content & Authenticity,Very fun game one of the best ive played from Total War,0.7775999903678894,"['one_best', 'ive_played']",2,"['one_best', 'ive_played']",2,"three_kingdoms, series, fan, diplomacy, battle, love, best_total_war, campaign, total_war_games, fun"
1594,Characters,"China history at last.
Also at the most interesting chapter.

",0.732200026512146,"['china', 'history', 'chapter']",3,"['chapter', 'china', 'history']",3,"china, war, cao_cao, lu_bu, liu_bei, yuan_shao, army, character, man, emperor"
2611,"UX/UI, Performance, Stability","Simply Amazing. More work needs to be done, but that doesn't take away from the fact that it is a great game.",0.6967999935150146,"['work', 'fact']",2,"['fact', 'work']",2,"campaign, hour, issue, battle, bug, crash, multiplayer, review, rome, fix"
1944,"UX/UI, Performance, Stability","keep crashing...become worst after patch.
crash at least 1 time per hour= =",0.7062000036239624,"['patch', 'crash']",2,"['patch', 'crash']",2,"campaign, hour, issue, battle, bug, crash, multiplayer, review, rome, fix"
