,dominant_topic,original_text,topic_perc_contrib,tokens,num_tokens,unique_tokens,num_unique_tokens,keywords
718,Characters,"First Total War game I've played, based on a time period that I love, and holy shit this game is fun.  Also steam summer sale.",0.517300009727478,"['time_period', 'shit', 'steam', 'summer_sale']",4,"['steam', 'shit', 'summer_sale', 'time_period']",4,"china, war, cao_cao, lu_bu, liu_bei, yuan_shao, army, character, man, emperor"
1615,Content & Authenticity,It's the best TW game so far!,0.6664000153541565,['best_tw'],1,['best_tw'],1,"three_kingdoms, series, fan, diplomacy, battle, love, best_total_war, campaign, total_war_games, fun"
1505,Characters,10/10 would father Sun Ren again,0.7430999875068665,"['father', 'sun_ren']",2,"['sun_ren', 'father']",2,"china, war, cao_cao, lu_bu, liu_bei, yuan_shao, army, character, man, emperor"
709,Characters,10/10 Would fertilize the rice fields of China again.,0.8068000078201294,"['fertilize', 'rice', 'field', 'china']",4,"['fertilize', 'china', 'field', 'rice']",4,"china, war, cao_cao, lu_bu, liu_bei, yuan_shao, army, character, man, emperor"
315,Content & Authenticity,One of the greatest three kingdom games I've ever played.,0.7760999798774719,"['one_greatest', 'three_kingdom']",2,"['three_kingdom', 'one_greatest']",2,"three_kingdoms, series, fan, diplomacy, battle, love, best_total_war, campaign, total_war_games, fun"
1013,Content & Authenticity,I am a hardcore fan!!! Diplomacy is pretty good over other TW titles. Finally worth using.,0.8662999868392944,"['hardcore', 'fan', 'diplomacy', 'tw_titles']",4,"['hardcore', 'fan', 'diplomacy', 'tw_titles']",4,"three_kingdoms, series, fan, diplomacy, battle, love, best_total_war, campaign, total_war_games, fun"
1953,Content & Authenticity,GAME IS AWESOME and just what i have been waiting for for the last 2 years and I'm so happy with the game so far cant wait for blood pack with further enhancements and the mod kits.,0.7739999890327454,"['year', 'blood_pack', 'enhancement', 'kit']",4,"['enhancement', 'blood_pack', 'year', 'kit']",4,"three_kingdoms, series, fan, diplomacy, battle, love, best_total_war, campaign, total_war_games, fun"
317,Content & Authenticity,"i even take days off to play this game.

Worth my money",0.7730000019073486,"['day', 'worth_money']",2,"['worth_money', 'day']",2,"three_kingdoms, series, fan, diplomacy, battle, love, best_total_war, campaign, total_war_games, fun"
39,Content & Authenticity,Best total war game out in a while.,0.6664000153541565,['best_total_war'],1,['best_total_war'],1,"three_kingdoms, series, fan, diplomacy, battle, love, best_total_war, campaign, total_war_games, fun"
1006,"UX/UI, Performance, Stability","Finaly a really good Total War game again, I wish they put as much effort to DLCs and new releases",0.4503999948501587,"['finaly', 'wish', 'effort', 'release']",4,"['wish', 'finaly', 'effort', 'release']",4,"campaign, hour, issue, battle, bug, crash, multiplayer, review, rome, fix"
1205,Content & Authenticity,One of the better total war games.,0.6661999821662903,['total_war_games'],1,['total_war_games'],1,"three_kingdoms, series, fan, diplomacy, battle, love, best_total_war, campaign, total_war_games, fun"
3078,Characters,"I want choose Dong Zhuo or He Jin,",0.6150000095367432,"['dong_zhuo', 'jin']",2,"['jin', 'dong_zhuo']",2,"china, war, cao_cao, lu_bu, liu_bei, yuan_shao, army, character, man, emperor"
3419,Content & Authenticity,"As a Dynasty Warriors and Total War fan, this is perfect. Also, it runs very well! Congratulations CA.",0.8317999839782715,"['dynasty_warriors', 'fan', 'run', 'congratulation']",4,"['fan', 'run', 'congratulation', 'dynasty_warriors']",4,"three_kingdoms, series, fan, diplomacy, battle, love, best_total_war, campaign, total_war_games, fun"
136,"UX/UI, Performance, Stability","Great game,
lacking in some areas, but overall a good experience i rate it 7/10",0.7371000051498413,"['area', 'experience', 'rate']",3,"['rate', 'area', 'experience']",3,"campaign, hour, issue, battle, bug, crash, multiplayer, review, rome, fix"
97,Content & Authenticity,One of the best Total War titles to date,0.8320000171661377,"['one_best_total_war', 'title', 'date']",3,"['title', 'one_best_total_war', 'date']",3,"three_kingdoms, series, fan, diplomacy, battle, love, best_total_war, campaign, total_war_games, fun"
189,Content & Authenticity,Very nice game but needs some fixing.,0.6615999937057495,['need'],1,['need'],1,"three_kingdoms, series, fan, diplomacy, battle, love, best_total_war, campaign, total_war_games, fun"
445,Content & Authenticity,"Never played a Total War game before, but this is a blast to play.",0.6662999987602234,['blast_play'],1,['blast_play'],1,"three_kingdoms, series, fan, diplomacy, battle, love, best_total_war, campaign, total_war_games, fun"
1084,Content & Authenticity,Best Total War in quite some time! Grab it!,0.7775999903678894,"['best_total_war', 'grab']",2,"['best_total_war', 'grab']",2,"three_kingdoms, series, fan, diplomacy, battle, love, best_total_war, campaign, total_war_games, fun"
397,Content & Authenticity,"Very fun, recommended if you have enjoyed previous Total War titles.",0.7770000100135803,"['previous_total_war', 'title']",2,"['title', 'previous_total_war']",2,"three_kingdoms, series, fan, diplomacy, battle, love, best_total_war, campaign, total_war_games, fun"
3599,Content & Authenticity,"Great fun , runs great , new features are fantastic! Highly recommended if any interest in the total war series",0.8330000042915344,"['new_features', 'highly_recommended', 'series']",3,"['series', 'new_features', 'highly_recommended']",3,"three_kingdoms, series, fan, diplomacy, battle, love, best_total_war, campaign, total_war_games, fun"
3113,Content & Authenticity,"Amazing game, this is what should have been the sequel to Shogun 2.

My only issue is the UI and some H.U.D. elements.",0.5691999793052673,"['sequel', 'shogun_two', 'issue', 'element']",4,"['sequel', 'shogun_two', 'issue', 'element']",4,"three_kingdoms, series, fan, diplomacy, battle, love, best_total_war, campaign, total_war_games, fun"
1564,Content & Authenticity,Great historical total war game. Love the focus on characters in the romance mode,0.7774999737739563,"['focus_characters', 'romance_mode']",2,"['romance_mode', 'focus_characters']",2,"three_kingdoms, series, fan, diplomacy, battle, love, best_total_war, campaign, total_war_games, fun"
